party,content,target,stance
nld: Green Left,De werkloosheid onder migranten is de afgelopen jaren meer dan verdubbeld.,Integration,NONE
nld: Party of Freedom,We bestrijden de dubbele nationaliteit.,Integration,AGAINST
nld: Socialist Party,Zolang wordt gewerkt aan terugkeer hebben ex-asielzoekers recht op opvang.,Integration,FAVOR
nld: Labour Party,"Dit betekent ook kansen bieden om de Nederlandse taal te leren, om mee te doen.",Integration,FAVOR
nld: Christian Union,Imams met een buitenlandse nationaliteit worden in dit geval uitgewezen.,Integration,AGAINST
nld: Christian Union,Voor de toekomst van ons land is iedereen even belangrijk en telt iedereen mee.,Integration,FAVOR
nld: Christian Democratic Appeal,Het is meer dan ‘klant’ zijn van de samen-leving of van de overheid.,Integration,FAVOR
nld: Green Left,In de opvang van asielzoekers moet rekening worden gehouden met de kwetsbare positie van kinderen.,Immigration,FAVOR
nld: Christian Union,"Juist in een tijd waarin de publieke implicaties van religie nogal eens miskend worden, erkent de ChristenUnie zonder terughoudendheid de rechten en de vrijheden van deze relatief nieuwe minderheid.",Integration,AGAINST
nld: Labour Party,Er wordt zorg geboden waar noodzakelijk en in de opvang is recht op privacy.,Immigration,FAVOR
nld: People’s Party for Freedom and Democracy ,De termijn voor het verkrijgen van een permanente verblijfsvergunning wordt opgerekt naar tien jaar.,Immigration,AGAINST
nld: Labour Party,Nederland heeft de naam een tolerant klimaat te hebben.,Integration,FAVOR
nld: Christian Democratic Appeal,"Indien na het verstrijken van de wettelijke vertrek-termijn nog geen vervangend reisdocument is ontvangen, wordt de opvang voortgezet zolang de betrokken vreemdeling kan aantonen dat hij activiteiten onderneemt om te voldoen aan de voorwaarden van de ambassade om zijn identiteit en/of nationaliteit aannemelijk te maken.",Immigration,NONE
nld: Christian Democratic Appeal,"En dat botst, vooral in de wijken en buurten waar het aandeel nieuwkomers, die de taal niet of nauwelijks machtig zijn, groot is.",Integration,AGAINST
nld: Christian Democratic Appeal,"Nieuwkomers krijgen te maken met hogere scholingseisen als zij zich langjarig in Nederland willen vestigen, uiteraard met ontheffingsmogelijkheden voor bijvoorbeeld mensen met beperkte vermogens.",Integration,AGAINST
nld: Christian Democratic Appeal,5.2.5. Het CDA neemt interreligieuze en interculturele spanningen buitengewoon serieus.,Integration,NONE
nld: Christian Democratic Appeal,Goed terugkeerbeleid vergt dat de samenleving in onderhavige geval-len in haar geheel meer gericht meewerkt aan het feitelijk vertrek van uitgeprocedeerde asielzoekers en illegale vreemdelingen.,Immigration,AGAINST
nld: Christian Democratic Appeal,"1.5.7 Asielzoekers die in (vervolg)procedure zijn voor een verblijfstatus in het kader van een asielverzoek en uit dien hoofde rechtmatig in Nederland verblijven, hebben recht op een goede opvang van rijkswege.",Immigration,FAVOR
nld: Democrats‘66,"Als na een asielprocedure blijkt dat er geen recht op bescherming bestaat, moet de overheid duidelijk zijn: de vreem deling moet terug naar zijn land van herkomst.",Immigration,AGAINST
nld: Socialist Party,We horen er allemaal bij en zullen het hoe dan ook in de toekomst samen moeten doen.,Integration,FAVOR
nld: Christian Democratic Appeal,"Het CDA staat pal voor de bescherming van vluchtelingen, maar is verder voor een selectief migratiebeleid: streng waar het moet, toegankelijk waar nodig.",Immigration,AGAINST
nld: Democrats‘66,"In een samenleving die steeds veelzijdiger wordt, moet de overheid staan voor de gemeenschappelijke waarden.",Integration,FAVOR
nld: Christian Union,"Blijft voorlichting en preventie op scholen en in jeugdcentra, jeugdinrichtingen en asielzoekerscentra van groot belang.",Integration,FAVOR
nld: Christian Democratic Appeal,internationale afspraken die verhinderen dat vluchtelingen jarenlang in kampen verblijven.,Immigration,FAVOR
nld: Reformed Political Party,De mogelijkheid van een dubbele nationaliteit wordt beperkt tot gevallen waarin het opgeven van de herkomstnationaliteit onmogelijk is.,Integration,AGAINST
nld: Christian Union,Er is maar één wereld en die wordt gedeeld door arm en rijk.,Immigration,FAVOR
nld: Labour Party,Integratie gaat over meer dan het overbruggen van sociaal-economische verschillen en taalproblemen: het heeft ook een culturele dimensie.,Integration,NONE
nld: Democrats‘66,Nederland heeft de afgelopen kabinetsperiode een integratiebeleid gevoerd dat gekenmerkt wordt door hardvochtigheid en willekeur.,Integration,AGAINST
nld: Labour Party,Integratie is in essentie een taak van burgers zelf.,Integration,FAVOR
nld: Green Left,Per 1 januari 2007 krijgen de inwoners van de landen die in 2004 zijn toegetreden tot de Europese Unie vrije toegang tot de Nederlandse arbeidsmarkt.,Immigration,NONE
nld: Socialist Party,In andere grote steden zien we eveneens een segregatie ontstaan.,Integration,AGAINST
nld: Reformed Political Party,Bij de bouw van moskeeën en minaretten moet wijze terughoudendheid betracht worden.,Integration,NONE
nld: Socialist Party,"Onze asielzoekerscentra zijn sober, op het inhumane af.",Immigration,AGAINST
nld: Democrats‘66,Over integratie blijven praten lost niets op.,Integration,FAVOR
nld: Green Left,"Dat vereist grotere inspanningen voor corruptiebestrijding, versterking van bestuur, rechtspraak, civiele  organisaties en de positie van vrouwen, alsmede onderhandelingen met gematigde Taliban.",Immigration,NONE
nld: Christian Union,"Het Mensenrechtenfonds wordt ingezet om een bijdrage te leveren aan vermindering van religieus geweld, het stimuleren van samenwerking en het faciliteren van projecten gericht op verzoening.",Integration,FAVOR
nld: Democrats‘66,"D66 ziet in de herziening van de Vreemdelingenwet een positieve ontwikkeling, al valt er met name op het terrein van het Europese asielbeleid, nog veel te verbeteren.",Immigration,FAVOR
nld: Christian Democratic Appeal,Dat geeft duidelijkheid aan de asielzoekers,Immigration,FAVOR
nld: Labour Party,Er zijn spanningen rond de integratie van moslims.,Integration,AGAINST
nld: Christian Union,De overheid is hierin een bondgenoot van de lokale bewoners door te werken aan integratie van nieuwkomers en bijvoorbeeld het algemene gebruik van het Nederlands verder te stimuleren zodat we elkaar allemaal verstaan.,Integration,FAVOR
nld: Party of Freedom,"Er bestaat onder mohammedanen een brede steun voor de invoering van de sjaria, de jihadaanslagen van 11 september en de afkeer van Joden en het Westen.",Integration,AGAINST
nld: People’s Party for Freedom and Democracy ,De VVD wil de toegang tot de sociale zekerheid voor vreemdelingen beperken.,Integration,AGAINST
nld: Christian Union,"Besteedt in het inburgeringprogramma én in het reguliere onderwijs aandacht aan culturele gedragingen en opvattingen die, hoewel niet onwettig, botsen met de in Nederland heersende culturele opvattingen.",Integration,AGAINST
nld: Green Left,"De jonge moslima’s die, met of zonder hoofddoek, de collegezalen bestormen.",Integration,FAVOR
nld: Christian Union,Het Vluchtelingenverdrag behoort ruimhartig te worden uitgevoerd.,Immigration,FAVOR
nld: Christian Union,Ze integreert en brengt zelfs veel jongeren over de grenzen van ons land.,Integration,NONE
nld: People’s Party for Freedom and Democracy ,"Het is echter niet de overheid die integreert, dat doen mensen zelf.",Integration,FAVOR
nld: Reformed Political Party,Het is niet logisch dat niet-Nederlanders stemrecht hebben bij lokale verkiezingen.,Integration,AGAINST
nld: Labour Party,"Integratie stagneert, de segregatie neemt toe.",Integration,AGAINST
nld: People’s Party for Freedom and Democracy ,"De VVD wil tot slot geen laaggeschoolde arbeidskrachten van buiten de EU toelaten, ook niet op tijdelijke basis.",Immigration,AGAINST
nld: Green Left,"30. Slachtoffers van mensenhandel krijgen een verblijfsvergunning als terugkeer naar het land van herkomst  gevaarlijk voor hen is, ook wanneer zij niet getuigen in het  strafproces.",Immigration,AGAINST
nld: Labour Party,"Het versterken van dat wat we gemeenschappelijk hebben, draagt bij aan vitale gemeenschappen.",Integration,FAVOR
nld: Christian Democratic Appeal,"Als het vaststellen van identiteit meer tijd kost of onderzoek naar traumata en andere medische aspecten nodig is, kan de eerste termijn (de AC-procedure) verlengd worden met nog eens 48 uur.",Immigration,NONE
nld: Party of Freedom,Verbod op buitenlandse financiering of buitenlandse bestuurlijke invloed moskeeën,Integration,AGAINST
nld: Christian Union,Nederland is een land van minderheden.,Integration,FAVOR
nld: People’s Party for Freedom and Democracy ,Iedereen die asiel wil vragen in de EU heeft de mogelijkheid en de verplichting om dat onmiddellijk bij binnenkomst te doen.,Immigration,NONE
nld: Reformed Political Party,"Antisemitisme leeft breed onder moslims, waarbij de diepgewortelde Jodenhaat nog wordt aangewakkerd door radicale zenders en andere media, die er alles aan  doen om het westen, Israël in het bijzonder, te demoniseren.",Integration,AGAINST
nld: Reformed Political Party,"En als het gaat om de toelating van asielzoekers en anderen die hun heil in Nederland zoeken, komt het aan op het vinden van een goed evenwicht tussen enerzijds rechtvaardigheid en anderzijds barmhartigheid.",Immigration,AGAINST
nld: Christian Union,Zo is het pijnlijk te constateren dat christenen en joden in islamitische landen vervolgd worden of als tweederangsburger worden beschouwd.,Integration,NONE
nld: Christian Democratic Appeal,En ze hebben er genoeg van om scheef aangekeken te worden op grond van wangedrag van anderen.,Integration,AGAINST
nld: People’s Party for Freedom and Democracy ,Problemen rondom integratie en immigratie verdwijnen niet vanzelf.,Immigration,AGAINST
nld: Reformed Political Party,Overheid en sociale partners moeten zichzelf verplichten tot een  extra inspanning om die achterstanden in te lopen en weg te werken.,Integration,AGAINST
nld: Reformed Political Party,"- De scherpe eisen voor reguliere migratie  (inkomen, leeftijd, woning) moeten worden gehandhaafd.",Immigration,AGAINST
nld: Democrats‘66,Het heeft vele vluchtelingen en immigranten onnodig hard getroffen en groot persoonlijk leed teweeg gebracht.,Integration,AGAINST
nld: Christian Democratic Appeal,"3.1.4 Bij de discussie over segregatie in het onder-wijs moet niet de etnische samenstelling van de leerlingpopulatie centraal staan, maar de kwaliteit van het onderwijs op school.",Integration,FAVOR
nld: Labour Party,Van de al langer in Nederland wonende bevolking wordt een open houding en een actieve belangstelling verwacht.,Integration,AGAINST
nld: Labour Party,We maken schoon schip met het verleden door een generaal pardon voor asielzoekers die onder de oude Vreemdelingenwet een verblijfsvergunning hebben aangevraagd.,Immigration,FAVOR
nld: Christian Union,"In het onderwijskansenbeleid moet niet alleen aandacht zijn voor achterblijvende leerlingen uit migrantengroepen, maar ook voor zwakke autochtone leerlingen.",Integration,FAVOR
nld: Christian Union,"Vreemdelingen die al langdurig in Nederland verblijven, geen strafblad hebben en waarvan terugkeer redelijkerwijs niet meer te vragen is, komen in aanmerking voor een pardon.",Integration,FAVOR
nld: Green Left,Ons land moet ook opkomen voor de vluchtelingen die elders aankloppen.,Immigration,FAVOR
nld: People’s Party for Freedom and Democracy ,"Vraagt iemand een verblijfsvergunning ‘asiel’ aan, dan kan dus niet tegelijkertijd of na afwijzing van deze aanvraag een verblijfsvergunning ‘regulier’ worden aangevraagd.",Immigration,AGAINST
nld: Socialist Party,Alle asielzoekers die in Nederland verblijven hebben recht op een humane opvang.,Immigration,FAVOR
nld: Socialist Party,Migranten moeten zich openstellen voor de waarden en de cultuur van de samenleving waar ze nu deel van uitmaken.,Integration,AGAINST
nld: Green Left,De AOW-uitkering gaat met 10% omhoog.,Integration,FAVOR
nld: People’s Party for Freedom and Democracy ,De VVD wil daarom met een samenhangend pakket maatregelen kansarme immigranten weren en hoogopgeleide kennismigranten aantrekken.,Immigration,AGAINST
nld: Reformed Political Party,"Ondanks het positieve dat ermee bereikt is, wordt de grondwettelijk verankerde onderwijsvrijheid steeds vaker aangevallen, niet in het minst uit angst voor de islam en het islamitisch onderwijs.",Integration,AGAINST
nld: Democrats‘66,"Het vindt plaats op het werk en in de klas, op straat en in de buurt.",Integration,FAVOR
nld: Democrats‘66,Nederland heeft de afgelopen kabinetsperiode een integratiebeleid gevoerd dat gekenmerkt wordt door hardvochtigheid en willekeur.,Integration,AGAINST
nld: Christian Democratic Appeal,"Om illegaliteit effectiever te bestrijden wordt hard opgetreden tegen mensen die van illegalen profiteren, zoals werkgevers, huisjesmelkers en mensensmokkelaars.",Immigration,AGAINST
nld: Party for the Animals,Initiatieven die tot doel hebben de sociale cohesie te bevorderen dienen gestimuleerd en waar mogelijk gesubsidieerd te worden.,Integration,FAVOR
nld: Democrats‘66,"Signalen van onderwijsinstellingen, politie en maatschappelijk werk moeten effectief worden samengebracht.",Integration,FAVOR
nld: Labour Party,Er komt een systeem van tijdelijke werkvergunningen voor werknemers van buiten de EU voor mensen die een arbeidscontract hebben.,Immigration,FAVOR
nld: Christian Democratic Appeal,het ontwikkelen van een gemeenschappelijk Europees beleid ten aanzien van immigratie.,Immigration,AGAINST
nld: Democrats‘66,Op zeer veel terreinen zal de grensoverschrijdende samenwerking moeten worden geïntensiveerd ten behoeve van burgers en bedrijfsleven.,Immigration,FAVOR
nld: Green Left,Huwelijksmigranten en kinderen kunnen zich in Nederland bij hun partner of ouder voegen.,Immigration,FAVOR
nld: Christian Union,De overheid voert noch een religieus noch een seculier voorkeursbeleid.,Integration,NONE
nld: People’s Party for Freedom and Democracy ,De VVD streeft ernaar dat elke aanvrager maximaal één aanvraag kan indienen voor een verblijfsvergunning ‘asiel’ of ‘regulier’.,Immigration,FAVOR
nld: Christian Union,Streektalen zijn belangrijk voor de eigen identiteit van gemeenschappen.,Integration,FAVOR
nld: Party of Freedom,Islamitische scholen gaan daarentegen dicht.,Integration,AGAINST
nld: Democrats‘66,"Want schooluitval kent vele oorzaken, niet alleen de culturele of sociale achtergrond van de scholier.",Integration,NONE
nld: Christian Democratic Appeal,1.5.1 Met een Europees asielbeleid moet worden voorkomen dat – door specifieke maatregelen van afzonderlijke landen van de Europese Unie – de asielstromen zich verleggen naar het voor asielzoekers en mensensmokkelaars meest gunstige land.,Immigration,AGAINST
nld: Party of Freedom,"Invoering van een quotum voor asielzoekers – maximaal 1.000 personen per jaar, opvang bij voorkeur in de regio",Immigration,AGAINST
nld: Christian Democratic Appeal,het creëren van een doeltreffend Europees vluchtelingenbeleid;,Immigration,AGAINST
nld: Green Left,De leeftijdsgrens is 18 jaar.,Integration,NONE
nld: Reformed Political Party,"Inburgering blijft verplicht, maar de verantwoordelijkheid en eigen bijdrage voor inburgering worden aanzienlijk verhoogd.",Integration,NONE
nld: Green Left,Religieuze groepen leveren vaak een waardevolle bijdrage aan de samenleving.,Integration,FAVOR
nld: Socialist Party,"Bedrijven en instellingen worden aangesproken op hun maatschappelijke verantwoordelijkheid voor het scheppen van werk voor gedeeltelijk arbeidsongeschikten, afgestudeerde VMBO’ers en kinderen van migranten.",Integration,FAVOR
nld: Democrats‘66,Homoseksuele asielzoekers die in eigen land vervolgd worden vinden in Nederland een veilige haven.,Immigration,FAVOR
nld: Christian Democratic Appeal,De resultaten van de pilots met ‘circulaire migratie’ bepalen de ruimte voor verdere ontwikkeling van dit concept.,Immigration,NONE
nld: Green Left,Te veel migranten hebben een sociaaleconomische achterstand.,Integration,AGAINST
nld: Democrats‘66,En dat leidt tot conflicten die wij niet willen en die ook niet nodig zijn.,Integration,AGAINST
nld: People’s Party for Freedom and Democracy ,De VVD ziet kansen voor hoogopgeleide kennismigranten om ons land en onze economie te versterken.,Immigration,FAVOR
nld: Socialist Party,"In tegenstelling tot de niet-westerse migranten, die hier meestal blijven.",Integration,NONE
nld: Democrats‘66,Voor de middellange termijn moet wat D66 betreft de oplossing gezocht worden in een aanpassing van de huidige conceptgrondwet waarbij meer dan nu het geval is nadruk wordt gelegd op de individuele grondrechten.,Integration,FAVOR
nld: People’s Party for Freedom and Democracy ,"Nadat een afwijzing van een aanvraag in rechte is komen vast te staan, kan er geen herhaalde aanvraag worden ingediend.",Immigration,AGAINST
nld: Green Left,Voor vreemdelingen die zich niet kunnen verzekeren is medische zorg beschikbaar.,Integration,FAVOR
nld: Christian Union,Onze multiculturele samenleving is ook een multireligieuze samenleving geworden.,Integration,FAVOR
nld: Christian Democratic Appeal,Integra-tie van nieuwe Nederlanders wordt het best bevorderd door kwalitatief goed onderwijs.,Integration,FAVOR
nld: Christian Union,"Er zijn sociale, culturele, religieuze, economische en politieke tegenstellingen langs etnische en culturele scheidslijnen die op dit moment de hele samenleving onder druk zetten.",Integration,AGAINST
nld: Socialist Party,Jarenlang gedwongen nietsdoen kan leiden tot stress en psychische problemen.,Integration,NONE
nld: Christian Union,"En dan niet op basis van kleur, maar op basis van feitelijke achterstand.",Integration,AGAINST
nld: Green Left,35. Er komt een helder criterium voor de toepassing van de  verkorte asielprocedure; duidelijk kansloze asielverzoeken  mogen verkort worden afgedaan.,Immigration,AGAINST
nld: Labour Party,Het wordt voor studenten en onderzoekers uit het buitenland minder moeilijk om een tijdelijke werk- en verblijfsvergunning te verkrijgen.,Immigration,FAVOR
nld: Green Left,Foute imams kunnen radicalisering aanwakkeren.,Integration,AGAINST
nld: Christian Union,Een effectief terugkeerbeleid is van groot belang.,Immigration,AGAINST
nld: Party of Freedom,Naturalisatie pas na 10 jaar rechtmatig verblijf in Nederland gedurende welke periode men volledig moet hebbengewerkt en geen misdrijf mag hebben gepleegd,Integration,FAVOR
nld: Labour Party,"Maar ook door als burger actief mee te doen in de samenleving, door het spreken van de taal, door te leren en te werken.",Integration,AGAINST
nld: Socialist Party,"Als het gaat om de beoordeling van de persoonlijke situatie, ligt de verhouding echter omgekeerd en zijn ‘autochtonen’ meer tevreden.",Integration,NONE
nld: Christian Union,Scholen met veel achterstandsleerlingen krijgen extra financiering.,Integration,AGAINST
nld: Labour Party,Van instanties en bedrijven mag worden verwacht dat zij toegankelijkheid en kwaliteit bieden en discriminatie bestrijden.,Integration,FAVOR
nld: Party for the Animals,In afwachting op uitzetting hebben uitgeprocedeerde asielzoekers recht op medische  zorg en mogen uitgeprocedeerde asielzoekers met kinderen niet meer op straat wor den gezet.,Immigration,AGAINST
nld: Christian Union,Een effectief terugkeerbeleid is van groot belang.,Immigration,AGAINST
nld: Party of Freedom,"Als het gaat om de klimaattheorieën van Al Gore, de massa-immigratie, de islamisering, de Europese superstaat, de ontwikkelingshulp, de kunstsubsidies, strenger straffen; de burger snapt het en de elites niet.",Immigration,AGAINST
nld: Green Left,Daar gaan we ontspannen mee om.,Integration,FAVOR
nld: Party for the Animals,Op Europees niveau moet Nederland zich sterk maken voor betere opvang van vluchtelingen in de eigen regio.,Immigration,FAVOR
nld: Labour Party,Het inzetten van illegale werknemers haalt ook de solidariteit van onze sociale verzekeringen en de werking van collectieve arbeidsovereenkomsten onderuit.,Integration,FAVOR
nld: Christian Democratic Appeal,Het moet mogelijk zijn de inburgering sneller af te ronden.,Integration,FAVOR
nld: Party of Freedom,"Redenen: het verlies van banen (voornamelijk aan de onderkant van de arbeidsmarkt), nieuwe integratieproblematiek van de volgende golf immigranten en de enorme kosten die dit voor de sociale zekerheid met zich meebrengt.",Integration,AGAINST
nld: Christian Democratic Appeal,"effectief optreden tegen terrorisme, mensenhandel, verspreiding van nucleair materiaal en andere vormen van grensoverschrijdende criminaliteit;",Immigration,AGAINST
nld: Socialist Party,Cultuur draagt bij aan de eigen identiteitsbeleving en de persoonlijke expressie van mensen en kan een rol spelen bij de integratie en emancipatie van verschillende bevolkingsgroepen.,Integration,FAVOR
nld: Christian Democratic Appeal,"1.3.2 Integratie van nieuwkomers is een weder-kerig proces tussen de samenleving die nieuwkomers welkom heet en nieuwkomers die zich de Nederlandse taal eigen maken, kennis nemen van de Nederlandse wetge-ving, cultuur en geschiedenis en hiervoor respect tonen.",Integration,FAVOR
nld: Green Left,GroenLinks kiest voor een activerende participatiestaat.,Integration,FAVOR
nld: Christian Union,De overheid biedt asielzoekers in procedure in Nederland opvang aan.,Immigration,FAVOR
nld: People’s Party for Freedom and Democracy ,"De kosten ervan - die op de samenleving worden afgewenteld - zijn te hoog, de opbrengsten te laag.",Integration,AGAINST
nld: Socialist Party,Uitval bij inburgering kan worden bestreden door individuele contracten en borgsommen.,Integration,FAVOR
nld: Labour Party,In de toekomst zullen we daar tevens een alfabetiseringstoets aan verbinden.,Integration,AGAINST
nld: Christian Union,Ze hebben baat bij inzicht in de Nederlandse samenleving en beheersing van de Nederlandse taal.,Integration,FAVOR
nld: Green Left,Asielzoekerscentra worden kleinschalig met voldoende privacy.,Immigration,FAVOR
nld: Reformed Political Party,Mogelijkheden voor opvang van vluchtelingen in de regio van herkomst moeten vergroot worden.,Immigration,FAVOR
nld: Party of Freedom,Dit is onze agenda van hoop en optimisme.,Immigration,AGAINST
nld: Christian Union,Vluchtelingen worden niet teruggestuurd als dat gevaar voor leven of vrijheid oplevert.,Immigration,FAVOR
nld: People’s Party for Freedom and Democracy ,Arbeidsparticipatie is de beste weg tot integratie.,Integration,FAVOR
nld: Christian Union,Het zijn mensen die kunnen werken en dat vaak ook willen.,Immigration,FAVOR
nld: Socialist Party,"De helft van de jeugd in de grote steden is van niet-westerse allochtone afkomst, 4 op de 10 niet-westerse allochtonen zijn in Nederland geboren.",Integration,NONE
nld: Democrats‘66,"Dat geldt voor illegalen, maar ook voor gedetineerden, daklozen, chronisch psychiatrische patiënten en asielzoekers.",Integration,FAVOR
nld: Christian Union,De overheid biedt asielzoekers in procedure in Nederland opvang aan.,Immigration,FAVOR
nld: Democrats‘66,"Van iedere burger wordt naar vermogen een bijdrage aan de samenleving gevraagd, zonder daarbij uit te gaan van een éénvormige identiteit.",Integration,AGAINST
nld: Socialist Party,Vrijheid van meningsuiting is geen rechtvaardiging om mensen te beledigen.,Integration,FAVOR
nld: Labour Party,"De komende tijd moet we ook taalles op de werkvloer mogelijk maken, inburgering koppelen aan school van jonge kinderen met achterstanden en het niveau van de lessen verder opkrikken.",Integration,FAVOR
nld: Socialist Party,"Verplichte taaltrajecten voor uitkeringsgerechtigden horen flexibel te zijn, zodat mensen die werk vinden, door kunnen gaan met Nederlands leren.",Integration,FAVOR
nld: Christian Democratic Appeal,2.1.12 Het CDA vindt het van belang dat scholen alle – dus ook allochtone – ouders bij het onderwijs betrekken.,Integration,FAVOR
nld: Reformed Political Party,"Radicaal-islamitische invloeden vanuit het buitenland, waaronder de komst van haatzaaiende imams naar Nederland, worden met kracht tegengegaan.",Integration,AGAINST
nld: Green Left,Met name asielzoekers met kinderen  hoeven niet steeds te verhuizen.,Immigration,FAVOR
nld: Socialist Party,En de samenleving moet een goede integratie mogelijk maken.,Integration,FAVOR
nld: Christian Democratic Appeal,Een groeiend aantal allochtone ondernemers geeft een impuls aan de Nederlandse economie.,Integration,FAVOR
nld: Party of Freedom,"Onze met veel moeite opgebouwde verzorgingsstaat is een bron van trots, maar is de afgelopen decennia tevens verworden tot een magneet voor slecht opgeleide immigranten.",Integration,AGAINST
nld: Party of Freedom,Vreemdelingen met een verblijfsvergunning voor bepaalde tijd geen recht meer op bijstand,Integration,AGAINST
nld: Green Left,Dat geldt bijvoorbeeld voor homo’s of mensen met een speciﬁeke religieuze achtergrond die niet veilig kunnen terugkeren in het land van herkomst.,Immigration,FAVOR
nld: Green Left,44. Overheden nemen hun verantwoordelijkheid voor noodopvang van asielzoekers die in fysieke en/of psychische nood  verkeren.,Integration,FAVOR
nld: Christian Union,Godsdienstvrijheid en een gelijkwaardige behandeling van minderheidsgroeperingen zijn onderdeel van de toetredingscriteria.,Integration,FAVOR
nld: Green Left,43. Wie buiten zijn of haar schuld Nederland niet kan verlaten  wordt niet op straat gezet en krijgt een tijdelijke verblijfsvergunning.,Integration,FAVOR
nld: Party for the Animals,"Deze armoede hangt vaak samen met oorlogen, hoge geboortecijfers en te weinig mogelijkheden om in de eigen behoeften te voorzien.",Immigration,AGAINST
nld: Party of Freedom,Alleen de PVV komt op voor het behoud van de verzorgingsstaat en pleit daarom voor het stopzetten van de immigratie uit islamitische landen.,Immigration,AGAINST
