party,content,target,stance
nld: People’s Party for Freedom and Democracy ,Daarvoor is het nodig dat de politie op sterkte is en kan ingrijpen. De VVD investeert in 3500 extra agenten op straat.,Integration,AGAINST
nld: Socialist Party,Asielzoekerscentra moeten beduidend beter worden ingericht.,Immigration,FAVOR
nld: Christian Union,De (dreigende) radicalisering van sommige moslimjongeren vraagt om alertheid en adequaat optreden van zowel de islamitische gemeenschap zelf als de overheid.,Integration,AGAINST
nld: Labour Party,"Die selectiviteit betekent dat we open blijven staan voor vluchtelingen conform de nieuwe Vreemdelingenwet,",Immigration,FAVOR
nld: Labour Party,"Het is primair de verantwoordelijkheid van de migrant om zich voor te bereiden op zijn komst naar Nederland, de taal te leren, zich op de samenleving te oriënteren en snel in te burgeren.",Integration,AGAINST
nld: Labour Party,In de kinderopvang krijgen alle kinderen de kans zich van jongs af aan spelenderwijs te ontwikkelen en te leren.,Integration,FAVOR
nld: Labour Party,"Selectief en mogelijkheden scheppend daar waar migranten een bijdrage kunnen leveren aan de economische, wetenschappelijke en culturele ontwikkeling van Nederland.",Integration,FAVOR
nld: Christian Union,Dit is in het bijzonder een aandachtspunt bij terugkeer naar islamitische landen.,Immigration,FAVOR
nld: Democrats‘66,Nederland veroordeelt de schending van homorechten in het buitenland en steunt buitenlandse homo-organisaties.,Integration,FAVOR
nld: Democrats‘66,Voor D66 moet het Nederlandse asielbeleid sporen met de Europese richtlijnen.,Immigration,NONE
nld: Reformed Political Party,"Moskeeën zijn allesbehalve een verrijking voor Nederland, net zomin als uitingen van andere godsdiensten en ideologieën dat zijn, waar Jezus Christus niet in het middelpunt staat.",Integration,FAVOR
nld: Christian Democratic Appeal,"We geven met elkaar vorm aan de publieke moraal, de manier waarop we met elkaar omgaan.",Integration,FAVOR
nld: Party of Freedom,De precieze kosten van de massa-immigratie worden momenteel berekend door onderzoeksinstituut Nyfer.,Immigration,AGAINST
nld: Democrats‘66,"Maatschappelijke aandacht voor de vrouw blijft nodig, in het bijzonder voor de positie van oudere en migrantenvrouwen.",Integration,FAVOR
nld: Christian Union,Dit besef van diversiteit klinkt ook door bij de aanstelling van ambtenaren van de burgerlijke stand.,Integration,FAVOR
nld: Christian Democratic Appeal,"Daarbij zal moeten worden gestreefd naar meer samenwerking tussen de EU- (en Schengen) lidstaten, zowel op operationeel (charters) als op diplomatiek niveau.",Immigration,FAVOR
nld: Christian Union,Het bijzonder onderwijs heeft het (grondwettelijk) recht om bij toelating van leerlingen van hun ouders onderschrijving van of respect voor de grondslag van de school te vragen.,Integration,FAVOR
nld: Socialist Party,Mensen die ouder zijn dan 55 jaar worden van deze verplichting vrijgesteld.,Integration,FAVOR
nld: Labour Party,De PvdA wil de leges verlagen.,Integration,FAVOR
nld: Labour Party,het onderlinge begrip tussen autochtonen en allochtonen verminderd,Integration,AGAINST
nld: Green Left,De toekomst mag ons niet overkomen.,Immigration,FAVOR
nld: Christian Democratic Appeal,Er moet een duidelijke koppeling zijn tussen immigratiebeleid en sociale zekerheid.,Immigration,FAVOR
nld: Green Left,Van de islamitische leerlingen gaat op dit moment 95 procent naar een niet-islamitische school.,Integration,FAVOR
nld: Party of Freedom,en geen enkele samenleving heeft een oneindige capaciteit om achterstanden te bestrijden en mensen te emanciperen.,Integration,AGAINST
nld: Socialist Party,"Ex-asielzoekers die door toedoen van het land van herkomst niet kunnen terugkeren, mogen hier blijven.",Integration,FAVOR
nld: Socialist Party,"In de praktijk blijkt dit niet voldoende bescherming te bieden, bij terugkomst in het eigen land lopen veel slachtoffers alsnog gevaar.",Immigration,FAVOR
nld: Democrats‘66,"Ook illegalen, gedetineerden, daklozen, chronisch psychiatrische patiënten en asielzoekers hebben recht op noodzakelijke zorg.",Integration,FAVOR
nld: Green Left,"Inburgeren in het moederland is geen voorwaarde voor een verblijfsvergunning,",Integration,FAVOR
nld: Green Left,Asielzoekers mogen niet worden afgeschoven naar landen buiten de Europese Unie.,Immigration,FAVOR
nld: Green Left,"Mensen die de Nederlandse nationaliteit krijgen, hoeven hun oude niet op te geven.",Integration,FAVOR
nld: Green Left,Asielzoekers mogen leren en werken zolang  ze in Nederland zijn.,Immigration,AGAINST
nld: Christian Union,Drie maanden na indiening van het asielverzoek gaat het recht op taalonderwijs in;,Integration,FAVOR
nld: Reformed Political Party,Integratie wordt bevorderd wanneer nieuwkomers weten waar zij aan toe zijn en wat zij in het land van aankomst kunnen verwachten.,Integration,FAVOR
nld: Christian Union,Discriminatie in welke vorm dan ook wordt bestreden.,Integration,FAVOR
nld: Democrats‘66,D66 vindt dat veel asielzoekers en vluchtelingen onnodig lang in onzekerheid verkeren over het wel of niet in Nederland mogen blijven.,Immigration,AGAINST
nld: Reformed Political Party,Het is een kwestie van behoorlijk bestuur dat asielprocedures binnen redelijke termijnen worden afgehandeld.,Immigration,FAVOR
nld: Christian Democratic Appeal,Re-integratiebedrijven dienen te worden ingezet voor moeilijk plaatsbaren.,Integration,AGAINST
nld: Green Left,"GroenLinks wil dat probleemgezinnen stevige begeleiding krijgen en dat straf niet alleen vergelding is, maar ook het begin van een opleiding of werk.",Integration,FAVOR
nld: Green Left,"Als veilige terugkeer niet mogelijk is, worden mensen niet op straat gezet, maar krijgen ze een verblijfsvergunning.",Immigration,FAVOR
nld: Labour Party,Deze gevoelens van vervreemding en –in essentie- onveiligheid spelen mede op door het ongemak dat mensen ervaren bij veranderingen in bevolkingssamenstelling die iedereen kan zien.,Integration,NONE
nld: People’s Party for Freedom and Democracy ,"De procedure die doorlopen moet worden om slecht presterende scholen te sluiten, wordt versneld.",Immigration,FAVOR
nld: Labour Party,Rechtvaardig ook omdat Nederland een veilig toevluchtsoord blijft voor echte vluchtelingen in nood.,Immigration,FAVOR
nld: Labour Party,Democratie en de rechtstaat zijn de beste garantie op het vreedzaam samenleven van verschillende groepen.,Integration,FAVOR
nld: Democrats‘66,een beter en gevarieerder woningaanbod in deze wijken te scheppen,Integration,FAVOR
nld: Reformed Political Party,- In de inburgeringcursus moet uitdrukkelijk aandacht zijn voor het probleem van het antisemitisme.,Integration,NONE
nld: Socialist Party,en van iedereen een bijdrage vraagt.,Integration,FAVOR
nld: Christian Union,"Gemeenten hebben de plicht mensen die door toedoen van de Dienst Terugkeer & Vertrek (DT&V) als illegaal op straat worden gezet, in een noodopvang te plaatsen.",Integration,NONE
nld: Christian Union,"Als Nederland voor politieke vluchtelingen geen wijkplaats is, werken wij mee aan hun onderdrukking.",Immigration,FAVOR
nld: Party for the Animals,"Ontwikkelingshulp dient daarom gericht te zijn op kennisontwikkeling, ontwikkeling van een zelfstandige regionale voedselvoorziening, gezondheidzorg en preventie van oorlogen.",Immigration,FAVOR
nld: Green Left,Vrijzinnig samenleven gaat niet zonder respect voor mensenrechten en minderheden.,Integration,FAVOR
nld: People’s Party for Freedom and Democracy ,Het aantrekkelijker maken van Nederland voor kenniswerkers en talent versterkt onze economie.,Immigration,FAVOR
nld: Christian Union,Ondertussen voelen veel migranten zich nog altijd buitenstaanders.,Integration,AGAINST
nld: Party of Freedom,Dus we hebben behoefte aan een selectief migratiebeleid.,Immigration,AGAINST
nld: Christian Union,"Asielzoekers die nog in afwachting zijn van een besluit over een verblijfsvergunning mogen betaald werk verrichten, maar zij bouwen op deze manier geen rechten op die een eventuele terugkeer naar het land van herkomst bemoeilijken.",Integration,FAVOR
nld: Party of Freedom,"Wat met veel strijd is opgebouwd, draagt nu bij aan de islamisering van Nederland.",Integration,AGAINST
nld: People’s Party for Freedom and Democracy ,Arbeidsparticipatie is volgens de VVD de beste manier om te integreren.,Integration,FAVOR
nld: Green Left,"Veel migranten die al lang in Nederland wonen en hier hun toekomst hebben, mogen wel stemmen bij lokale verkiezingen, maar niet bij landelijke en Europese.",Immigration,FAVOR
nld: Socialist Party,"In de vorige eeuw werden ‘gastarbeiders’ naar hier gehaald, door bedrijven die goedkope arbeidskrachten zochten.",Immigration,NONE
nld: Reformed Political Party,"Uitingen als antisemitisme, racisme en ontkenning van volkerenmoord worden streng bestraft.",Integration,NONE
nld: Reformed Political Party,Dat uitgangspunt verplicht tot het bestrijden van achterstelling en onrecht.,Integration,FAVOR
nld: Green Left,Besnijdenis bij islamitische vrouwen komt nog steeds voor.,Integration,NONE
nld: People’s Party for Freedom and Democracy ,Ook biedt goed onderwijs iedere leerling - ongeacht zijn afkomst - kennis van en inzicht in de Nederlandse samenleving en rechtstaat.,Integration,FAVOR
nld: Christian Union,"Ook als we diepgaande religieuze verschillen hebben of ons aan elkaar ergeren, blijft de ruimte voor verschil – binnen de grenzen van de wet – gewaarborgd.",Integration,FAVOR
nld: Christian Union,"Migranten zijn gebaat bij forse uitbreiding van het aantal werkervaringsplaatsen c.q. stageplaatsen in het bedrijfsleven, bij de overheid en in de non-profitsector.",Integration,FAVOR
nld: Christian Union,"Een andere grote vraag waar we voor staan, is of we in staat zijn vreedzaam met onze verschillen om te gaan.",Integration,FAVOR
nld: Christian Democratic Appeal,Ook de rol van de autochtone bevolking in het stre-ven naar sociale cohesie verdient aandacht.,Integration,FAVOR
nld: Christian Union,Nederland blijft invulling geven aan zijn internationale verantwoordelijkheid om bij te dragen aan de bescherming van vluchtelingen.,Immigration,FAVOR
nld: Socialist Party,"Veel mensen die onder de oude vreemdelingenwet asiel hebben aangevraagd, zijn al vele jaren hier.",Immigration,FAVOR
nld: Christian Union,Het inburgeringsexamen toetst ook de kennis van centrale Nederlandse waarden zoals onze politieke en religieuze vrijheden.,Integration,AGAINST
nld: Democrats‘66,Helaas is vooral onder de ‘outsiders’ in de samenleving de werkloosheid vaak nog hoog.,Integration,AGAINST
nld: Democrats‘66,"Dit geldt vooral in de vier grote steden, maar het speelt ook elders.",Integration,FAVOR
nld: Christian Union,Leerlingen vertellen over en weer over elkaars geloof en cultuur.,Integration,FAVOR
nld: Labour Party,Fundamentele veranderingen als globalisering en migratie hebben dit verschijnsel nog eens versterkt.,Immigration,NONE
nld: People’s Party for Freedom and Democracy ,"Huwelijksimmigranten worden alleen toegelaten wanneer zij naar Nederlandse maatstaven voldoende zijn opgeleid,",Immigration,AGAINST
nld: People’s Party for Freedom and Democracy ,"Illegaliteit leidt vaak tot uitbuiting, criminaliteit en prostitutie en moet keihard worden bestreden.",Immigration,AGAINST
nld: Christian Democratic Appeal,Participatie is immers goed voor de integratie en door te werken ontwikkelen mensen hun talenten.,Integration,FAVOR
nld: Christian Democratic Appeal,2.3.4 De voorstellen voor verbetering van de asielprocedure en het terugdringen van herhaalde aanvragen worden voortvarend ingevoerd.,Immigration,FAVOR
nld: Socialist Party,Meer middelen worden beschikbaar gesteld voor de opvang van vluchtelingen in de regio.,Immigration,AGAINST
nld: Christian Democratic Appeal,"De veiligheidsproblematiek is de afgelopen tijd steeds complexer geworden: falende staten, terrorisme en het bezit van nucle-aire kennis kunnen gaan samenvallen.",Immigration,AGAINST
nld: Reformed Political Party,Druk van bovenaf om te komen tot een twee statenoplossing wijst de SGP dan ook af.,Immigration,AGAINST
nld: Party of Freedom,Eerste tien jaar verblijf vreemdelingen in Nederland: geen recht op uitkering,Integration,AGAINST
nld: Reformed Political Party,Daarom dient  de organisatie van de IND dringend te verbeteren.,Immigration,FAVOR
nld: Christian Union,Integratie van gehandicapte kinderen in het reguliere basisonderwijs verdient de voorkeur.,Integration,FAVOR
nld: Christian Union,"Steeds duikt ze weer op, de discussie over de bijdrage van het bijzonder onderwijs aan integratie.",Integration,FAVOR
nld: Labour Party,"Bij de integratie van migranten is een grote inspanning van de migrant en de inzet van alle burgers, instanties en bedrijven vereist.",Integration,FAVOR
nld: Reformed Political Party,Er moet meer specifieke aandacht komen voor de landbouwsector in ontwikkelingslanden.,Immigration,NONE
nld: Party of Freedom,"Respect voor de vele lokale tradities: kievietseieren zoeken in Friesland, carnaval in Limburg etc.",Integration,AGAINST
nld: Socialist Party,"Discriminatie op basis van geslacht, etniciteit, religie, seksuele geaardheid en handicap wordt stevig aangepakt.",Integration,FAVOR
nld: Christian Union,"Nederland verplicht zich tegenover de UNHCR om een substantieel hoger aantal vluchtelingen dan nu het geval is op te nemen, die uit een gevaarlijke en uitzichtloze situatie dringend herhuisvesting nodig hebben.",Immigration,FAVOR
nld: Christian Democratic Appeal,5.2.10 Het CDA wil de export van de welvaartstoeslagen op de uitkeringen staken voor zover deze zijn gebaseerd op het welvaart- en voorzieningenniveau in Nederland.,Immigration,AGAINST
nld: Reformed Political Party,Te veel uitgeprocedeerden vertrekken met onbekende bestemming.,Immigration,AGAINST
nld: Green Left,Dat doen we onder meer via bestaande internationale netwerken.,Integration,AGAINST
nld: Democrats‘66,"D66 ziet ook een nieuwe groep internationalen en partners, die meerdere keren in een decennium in Nederland komen om te werken en wonen en dan weer ergens anders een project hebben.",Immigration,FAVOR
nld: Green Left,Europese scholieren en studenten lopen steeds vaker een tijdje stage in een ander land van de Europese Unie.,Integration,FAVOR
nld: Christian Democratic Appeal,Voor hen die geen recht op verblijf hebben moet er een goed terugkeerbeleid komen.,Immigration,AGAINST
nld: Reformed Political Party,"Die problemen moeten gericht en resoluut worden aangepakt, in een uiterst geval door de rechter te verzoeken het bestuur te ontslaan.",Integration,AGAINST
nld: Party of Freedom,Geen moskee er meer bij,Integration,AGAINST
nld: Christian Democratic Appeal,Voorwaarde voor het verkrijgen van de tijdelijke verblijfsvergunning is dat de nieuwkomer aantoont dat hij of zij invulling geeft aan de inburgeringplicht.,Integration,NONE
nld: Democrats‘66,Tevens weten we nooit waarvoor die vinderafdrukken in de toekomst wellicht ooit gebruikt gaan worden.,Immigration,NONE
nld: Labour Party,Mensen zonder verblijfstitel kunnen geen aanspraak maken op verblijf in Nederland.,Immigration,AGAINST
nld: Green Left,Veilige terugkeer van uitgeprocedeerde asielzoekers wordt afgedwongen door met herkomstlanden terugkeer overeenkomsten af te sluiten.,Immigration,AGAINST
nld: Labour Party,"De informatie in de ambtsberichten van het Ministerie van Buitenlandse Zaken, die van invloed zijn op de verblijfsduur van de asielzoeker in Nederland, moet worden verbeterd.",Immigration,FAVOR
nld: Democrats‘66,Toch vindt u in ons programma geen apart hoofdstuk hierover.,Integration,AGAINST
nld: Christian Union,"De liberaal moet de christen zien staan; de moslim de jood; de christen de moslim, enzovoorts.",Integration,FAVOR
nld: Christian Democratic Appeal,De weg moet worden geëffend voor hun terugkeer.,Immigration,AGAINST
nld: Christian Union,In deze preambule kan uitdrukking worden gegeven aan de historische identiteit en de dragende waarden van de Nederlandse samenleving.,Integration,FAVOR
nld: People’s Party for Freedom and Democracy ,"Dankzij de VVD zijn vanaf 2002 belangrijke stappen genomen om het asiel- en immigratiebeleid streng, rechtvaardig en consequent toe te passen.",Immigration,AGAINST
nld: Party for the Animals,Initiatieven die tot doel hebben de sociale cohesie te bevorderen moeten gestimu- leerd en waar mogelijk gesubsidieerd worden.,Integration,FAVOR
nld: Democrats‘66,Daar tref je mensen met andere omgangsvormen.,Integration,NONE
nld: Christian Union,In overleg met in het bijzonder Curaçao worden maatregelen ontworpen om de migratie van kansarme jongeren naar Nederland tegen te gaan.,Immigration,AGAINST
nld: Socialist Party,Integratie komt van twee kanten.,Integration,FAVOR
nld: Green Left,"Partners kunnen na één jaar afhankelijk verblijfsrecht een zelfstandig permanent verblijfsrecht krijgen of eerder als er sprake is van fysiek of psychisch geweld, seksueel misbruik of overlijden van de partner.",Integration,AGAINST
nld: Labour Party,Emancipatie is en blijft van belang.,Integration,FAVOR
nld: Labour Party,De beschikbare ODA-HGIS middelen kunnen zo binnen één kader worden afgewogen.,Immigration,FAVOR
nld: Party for the Animals,Immigranten worden geacht zichzelf de taal en noodzakelijke sociale vaardigheden eigen te maken om in de Nederlandse samenleving te functioneren; de overheid ziet  er op toe dat dit gebeurt en is hierbij behulpzaam.,Integration,FAVOR
nld: Socialist Party,"In het rapport Gedeelde toekomst. Voorstellen voor participatie, emancipatie en integratie doen we een groot aantal voorstellen om de segregatie in onze samenleving te bestrijden, de integratie te bevorderen en discriminatie tegen te gaan.",Integration,FAVOR
nld: Socialist Party,Alle vormen van discriminatie en achterstelling moeten hard worden aangepakt.,Integration,FAVOR
nld: Socialist Party,Migranten met een taal- en kennisachterstand horen die achterstand in te halen.,Integration,AGAINST
nld: Party of Freedom,"Nederlandse nationaliteit pas na tien jaar rechtmatig verblijf in Nederland, mits geen strafblad",Integration,AGAINST
nld: Christian Union,"Die rechtsstaat, die sterk beïnvloed is door de waarden van het christendom, maakt alle burgers voor de wet gelijk.",Integration,FAVOR
nld: Christian Democratic Appeal,"Van belang, zeker voor hoogopgeleide vluchtelingen, is dat erkenning van reeds opgedane werkervaring en behaalde diploma’s in het land van herkomst, bevorderd wordt.",Integration,FAVOR
nld: Christian Union,Misbruik van grondwettelijke vrijheden is niet geoorloofd.,Integration,AGAINST
nld: Christian Union,"Waar hoofddoekjes niet tot functionele bezwaren leiden, vormt dit evenmin een belemmering.",Integration,FAVOR
nld: Socialist Party,Inzet van illegale arbeid is schadelijk voor binnen- én buitenlandse arbeidskrachten en moet worden voorkomen.,Integration,AGAINST
nld: Democrats‘66,In Nederland verblijven nu meer dan 100.000 arbeidsmigranten uit deze landen.,Immigration,AGAINST
nld: Green Left,Wij willen nuchter omgaan met migratie in Nederland.,Immigration,FAVOR
nld: People’s Party for Freedom and Democracy ,"Inburgeraars gaan dit examen zelf betalen, eventueel ondersteund met een leenfaciliteit.",Integration,FAVOR
nld: People’s Party for Freedom and Democracy ,De aanhoudende toestroom van kansarme migranten werkt het oplossen van integratieproblemen tegen en moet daarom worden gestopt.,Immigration,AGAINST
nld: People’s Party for Freedom and Democracy ,De VVD wil bovendien een eind maken aan de mogelijkheid tot ’loketshoppen‘.,Immigration,AGAINST
nld: Democrats‘66,D66 vindt dat het Nederlandse asielbeleid moet sporen met de Europese richtlijnen.,Immigration,FAVOR
nld: Christian Union,"In de tweede plaats een hernieuwd besef bij iedereen in dit land, dat tolerantie geen onverschilligheid betekent (dat doet geen pijn) maar een samenleven in één land, terwijl verschillen van levenswijze en levensovertuiging wel degelijk steken en botsen.",Integration,FAVOR
nld: Christian Union,Gezinnen van asielzoekers en vluchtelingen worden niet gescheiden.,Immigration,FAVOR
nld: Party of Freedom,"Kinderen leren nu over hoe mooi de islam is en dat het een verrijking is van Nederland, maar wat de Tachtigjarige Oorlog was, is hen onbekend.",Integration,AGAINST
nld: People’s Party for Freedom and Democracy ,"De prioriteiten van de VVD liggen bij de economie, onze veiligheid en integratie en immigratie.",Integration,FAVOR
nld: People’s Party for Freedom and Democracy ,"Als die regionale opvangmogelijkheden er niet zijn, kan asiel in de EU worden aangevraagd.",Immigration,AGAINST
nld: People’s Party for Freedom and Democracy ,Medicalisering van de asielprocedure wordt tegengegaan.,Immigration,AGAINST
nld: Socialist Party,Ook dient veel harder dan nu opgetreden te worden tegen mensenhandelaren.,Immigration,FAVOR
nld: Labour Party,De toekomst van het asielbeleid ligt in Europa.,Immigration,FAVOR
nld: Reformed Political Party,Uiteraard moeten we misbruik van de asielmogelijkheden bestrijden.,Immigration,FAVOR
nld: Labour Party,Radicalisering onder met name islamitische jongeren moet worden bestreden door deze jongeren weerbaar te maken tegen radicale invloeden.,Integration,NONE
nld: Green Left,"Nieuwkomers dienen de Nederlandse taal te leren, in te burgeren, naar school te gaan en te werken.",Integration,AGAINST
nld: Christian Democratic Appeal,1.5.6 Asielzoekers die in afwachting zijn van een beslissing omtrent hun definitieve verblijfsstatus kunnen in aanmerking komen voor scholing en arbeid.,Integration,FAVOR
nld: Socialist Party,"Illegalen (zoals uitgeprocedeerde asielzoekers) en onverzekerden (zoals zwervers) mogen niet worden uitgesloten van medisch/psychiatrisch noodzakelijke hulp, ook wanneer ze niet kunnen voldoen aan de identificatieplicht.",Integration,FAVOR
nld: Christian Union,"Vreemdelingen die in ons land zijn overgegaan naar een andere godsdienst worden in geen geval gedwongen terug te keren naar het land van herkomst, indien daar in de praktijk sprake is van vervolging van betrokkene.",Immigration,FAVOR
nld: People’s Party for Freedom and Democracy ,Die scholen moeten veel sneller worden gesloten.,Integration,AGAINST
nld: Green Left,"38. Als na 3 jaar nog geen definitieve beslissing op een  asielverzoek is genomen, wordt een verblijfsvergunning  toegekend.",Immigration,FAVOR
nld: Christian Democratic Appeal,Van nieuwkomers mogen we verwachten dat zij een extra inzet leveren om hun plaats te vinden in de samenleving.,Integration,FAVOR
nld: Socialist Party,Asielzoekers die niet als vluchteling worden erkend moeten terugkeren.,Immigration,AGAINST
nld: Christian Union,"De bedragen die omgaan in internationale handel en grensoverschrijdende investeringen, en donaties die migranten terugsturen naar de familie in hun thuisland, vormen veel omvangrijker geldstromen.",Integration,AGAINST
nld: Christian Union,Niet voor het permanent in stand houden van multiculturele organisaties.,Integration,FAVOR
nld: Socialist Party,Ter verbetering van de positie van naar Nederland teruggekeerde emigranten met een onvolledige AOW-opbouw vervalt de vermogenstoets voor aanvullende bijstand.,Integration,FAVOR
nld: Green Left,"Er komt een inburgeringseis in Nederland  in plaats van in het buitenland, alsmede een opleidingstraject: toegelaten partners gaan, als zij nog geen startkwalificatie voor de arbeidsmarkt hebben, een opleiding  op maat volgen.",Integration,FAVOR
nld: Reformed Political Party,Het is wenselijk dat nieuwkomers op dergelijke punten kritisch blijven.,Integration,NONE
nld: Green Left,tenzij ze strafrechtelijk zijn veroordeeld voor ernstige misdrijven.,Immigration,AGAINST
nld: Christian Union,Het is onterecht en zelfs beledigend voor de scholen die het betreft om te suggereren dat een identiteitsgebonden school selecteert op kleur of etniciteit.,Integration,FAVOR
nld: Reformed Political Party,Anderzijds dienen opvattingen die wortelen in de christelijke traditie gerespecteerd te worden.,Integration,FAVOR
nld: Socialist Party,Taal- en inburgeringcursussen voor oudkomers moeten gratis zijn.,Integration,FAVOR
nld: Socialist Party,Nederland moet in haar asielbeleid uitvoering geven aan de verdragen waaraan we ons gebonden hebben.,Immigration,AGAINST
nld: Christian Union,De acceptatieplicht is een vorm van symboolpolitiek die iets anders bereikt dan wat de partijen zeggen te willen bereiken.,Integration,FAVOR
nld: Democrats‘66,D66 vindt dat de overheid uiterlijk binnen drie jaar moet beslissen over het verblijfsrecht van de asielzoeker.,Immigration,FAVOR
nld: Green Left,Het is terecht dat het oude motto ‘integratie met behoud van eigen identiteit’ aan de kant is gezet.,Integration,AGAINST
nld: Socialist Party,Er komt een generaal pardon voor (ex-)asielzoekers die onder de oude vreemdelingenwet asiel hebben aangevraagd.,Immigration,FAVOR
nld: Party of Freedom,"Geen hoofddoekjes in de zorg, het onderwijs, het gemeentehuis of waar dan ook bij de overheid, en evenmin bij welke gesubsidieerde organisatie dan ook",Integration,AGAINST
nld: Christian Union,Die combinatie van integratie en diversiteit is uniek en wordt gedragen door ledenomroepen waaraan bijna vier miljoen Nederlanders zich hebben verbonden.,Integration,FAVOR
nld: Party of Freedom,Dankzij die club in Brussel wordt Europa in rap tempo Eurabië.,Immigration,AGAINST
nld: Party of Freedom,Wat zeker niet bestaat is een gematigde islam.,Integration,AGAINST
nld: Christian Democratic Appeal,Maar de overgrote meerderheid hier wonende immigranten doet het goed.,Integration,FAVOR
nld: Green Left,Voor de opleidingskosten kan een vorm  van studiefinanciering worden aangevraagd.,Integration,FAVOR
nld: Labour Party,Het moet gemakkelijker worden voor lagere en middeninkomens om hun eerste eigen huis te kopen.,Integration,FAVOR
nld: Christian Democratic Appeal,Ook worden microkredieten gemakkelijker verstrekt; die geven met name allochtone ondernemers een betere start en doorgroei.,Integration,FAVOR
